{
  "$schema": "../schema.json",
  "schema_version": "1.0",
  "id": "2026-09-26T05-30-00Z__PSI-040__hermes",
  "task_ids": ["PSI-040"],
  "agent": {
    "name": "hermes",
    "model": "omniroute:combo-cheaper-inference-prio",
    "operator": "ficana"
  },
  "session": {
    "started_at": "2026-09-26T05:30:00Z",
    "ended_at": "2026-09-26T05:55:00Z",
    "branch": "task/PSI-040"
  },
  "intent": "PSI-040: Deploy Migration M4 calendar schema, triggers, and pgTAP test assertions.",
  "outcome": "done",
  "summary": "Applied migration M4 (20260926025252_calendar_schema.sql) creating events and event_audience tables with polymorphic target constraints, can_see_event and is_event_creator helpers, event_audience_user_ids recipient resolution function, event_audience_invites and events_notify_update notification triggers, calendar_feed_tokens table, and events_for_user function for ICS feeds. Added pgTAP test assertions in supabase/tests/calendar.test.sql.",
  "changes": [
    {
      "path": "supabase/migrations/20260926025252_calendar_schema.sql",
      "action": "added",
      "note": "Migration M4 calendar schema and triggers"
    },
    {
      "path": "supabase/tests/calendar.test.sql",
      "action": "added",
      "note": "pgTAP test assertions for calendar"
    },
    {
      "path": "frontend-architecture/src/lib/supabase/database.types.ts",
      "action": "modified",
      "note": "Regenerated database types"
    },
    {
      "path": "obsidian-out/review/PSI-040.md",
      "action": "added",
      "note": "Review card and verification report"
    },
    {
      "path": "docs/list-task-project.md",
      "action": "modified",
      "note": "PSI-040 status updated to review"
    }
  ],
  "decisions": [
    {
      "decision": "Use check (num_nonnulls(user_id, role_id, group_id) = 1) on event_audience",
      "reason": "Enforces strict polymorphic audience exclusivity at database level."
    },
    {
      "decision": "Skip notification triggers when source = 'google'",
      "reason": "Prevents redundant re-notification spam when synchronizing external calendar feeds."
    }
  ],
  "verification": {
    "typecheck": "pass",
    "lint": "pass",
    "build": "pass",
    "db_reset": "pass",
    "db_tests": "pass",
    "manual": "Verified pgTAP test suite with 35 assertions passing cleanly."
  },
  "human_review": {
    "required": true,
    "reason": "Awaiting human operator review stamp on PSI-040 card."
  }
}
