{
  "$schema": "../schema.json",
  "schema_version": "1.0",
  "id": "2026-09-26T06-30-00Z__PSI-044__hermes",
  "task_ids": ["PSI-044"],
  "agent": {
    "name": "hermes",
    "model": "omniroute:combo-cheaper-inference-prio",
    "operator": "ficana"
  },
  "session": {
    "started_at": "2026-09-26T06:30:00Z",
    "ended_at": "2026-09-26T06:55:00Z",
    "branch": "task/PSI-044"
  },
  "intent": "PSI-044: Implement ICS subscription feed route and token rotation UI.",
  "outcome": "done",
  "summary": "Implemented /api/calendar/feed/[token] endpoint using createServiceClient to resolve feed tokens and call events_for_user RPC, generating RFC 5545 VCALENDAR feeds via ics. Added getCalendarFeedTokenAction and rotateCalendarFeedTokenAction server actions, and built CalendarFeedDialog in the calendar header for feed URL copying and token rotation.",
  "changes": [
    {
      "path": "frontend-architecture/src/lib/supabase/service.ts",
      "action": "added",
      "note": "Server-only service client constructor"
    },
    {
      "path": "frontend-architecture/src/app/api/calendar/feed/[token]/route.ts",
      "action": "added",
      "note": "Next.js ICS feed route handler"
    },
    {
      "path": "frontend-architecture/src/features/calendar/actions.ts",
      "action": "modified",
      "note": "Added feed token fetch and rotation actions"
    },
    {
      "path": "frontend-architecture/src/features/calendar/components/calendar-feed-dialog.tsx",
      "action": "added",
      "note": "Modal dialog for feed subscription and token rotation"
    },
    {
      "path": "frontend-architecture/src/features/calendar/components/calendar-header.tsx",
      "action": "modified",
      "note": "Integrated CalendarFeedDialog into header actions"
    },
    {
      "path": "frontend-architecture/src/components/icons.tsx",
      "action": "modified",
      "note": "Added copy and rss icons"
    },
    {
      "path": "obsidian-out/review/PSI-044.md",
      "action": "added",
      "note": "Review card and verification report"
    },
    {
      "path": "docs/list-task-project.md",
      "action": "modified",
      "note": "PSI-044 status updated to review"
    }
  ],
  "decisions": [
    {
      "decision": "Use server-only createServiceClient() to access calendar_feed_tokens and events_for_user",
      "reason": "ICS subscription route is unauthenticated by design and calendar_feed_tokens/events_for_user are restricted to service_role."
    }
  ],
  "dependencies_added": [
    {
      "name": "ics",
      "version": "^3.12.0",
      "reason": "Standard compliant RFC 5545 iCalendar serialization"
    }
  ],
  "verification": {
    "typecheck": "pass",
    "lint": "pass",
    "build": "pass",
    "db_reset": "pass",
    "db_tests": "pass",
    "manual": "Verified ICS feed generation and token rotation actions compile cleanly."
  },
  "human_review": {
    "required": true,
    "reason": "Awaiting human operator review stamp on PSI-044 card."
  }
}
