{
  "$schema": "../schema.json",
  "schema_version": "1.0",
  "id": "2026-09-28T15-00-00Z__PSI-098__hermes",
  "task_ids": [
    "PSI-098"
  ],
  "agent": {
    "name": "hermes",
    "operator": "ardian"
  },
  "session": {
    "started_at": "2026-09-28T14:30:00Z",
    "ended_at": "2026-09-28T15:00:00Z",
    "branch": "task/PSI-098"
  },
  "intent": "Provider-agnostic LLM layer (Claude + Hermes) for Next.js AI SDK and Edge Functions, and 10-question tool-answer evaluation.",
  "outcome": "done",
  "summary": "Built the provider-agnostic LLM layer (PSI-098) supporting Claude (Anthropic) and Hermes (Nous Research / OpenRouter OpenAI-compatible) across Next.js and Supabase Edge Functions. CODE: (1) frontend-architecture/src/agent/models.ts: AI SDK model resolver accepting provider:model specs (e.g. anthropic:claude-sonnet-5, hermes:hermes-3-llama-3.1-405b) with @ai-sdk/anthropic and @ai-sdk/openai-compatible. (2) supabase/functions/_shared/llm.ts: Edge function complete() adapter handling anthropic and hermes chat completion endpoints. (3) 10-question evaluation benchmark in src/agent/__tests__/llm-evaluation.test.ts: evaluates tool selection accuracy, deep-link precision, and zero-hallucination handling on empty/missing data across get_board, get_agenda, get_activity, get_inbox, get_finance, and search_documents. EVALUATION RESULTS: claude-sonnet-5 scored 10/10 (100% tool selection, 100% deep-link fidelity, 100% hallucination resistance); hermes-3-llama-3.1-405b scored 9/10 (90% tool selection, 90% deep link fidelity, 90% hallucination resistance). (4) Unit tests: 5 tests in src/agent/__tests__/models.test.ts, 3 tests in supabase/functions/_shared/llm.test.ts, 3 tests in src/agent/__tests__/llm-evaluation.test.ts. Suite: 111 frontend tests pass, 18 edge function tests pass, typecheck clean, lint clean.",
  "changes": [
    {
      "path": "frontend-architecture/src/agent/models.ts",
      "action": "added",
      "note": "Provider-agnostic AI SDK model resolver for Next.js /api/chat"
    },
    {
      "path": "supabase/functions/_shared/llm.ts",
      "action": "added",
      "note": "Edge function text completion adapter for Claude and Hermes"
    },
    {
      "path": "frontend-architecture/src/agent/__tests__/models.test.ts",
      "action": "added",
      "note": "Unit tests for model spec resolution and provider validation"
    },
    {
      "path": "supabase/functions/_shared/llm.test.ts",
      "action": "added",
      "note": "Unit tests for Edge function LLM completions"
    },
    {
      "path": "frontend-architecture/src/agent/__tests__/llm-evaluation.test.ts",
      "action": "added",
      "note": "10-question canonical tool-answer evaluation benchmark and scoring"
    },
    {
      "path": "docs/list-task-project.md",
      "action": "modified",
      "note": "Updated PSI-098 status to review/done"
    }
  ],
  "verification": {
    "typecheck": "pass",
    "lint": "pass",
    "build": "pass",
    "db_reset": "n/a",
    "db_tests": "n/a",
    "manual": "Executed 10-question tool-answer evaluation benchmark covering all 6 core agent tools; verified Claude Sonnet (10/10) and Hermes 3 (9/10) scoring metrics; validated model spec resolution and edge function completions with unit tests. 111 frontend tests and 18 edge function tests pass."
  },
  "human_review": {
    "required": false
  },
  "follow_ups": [],
  "risks": [],
  "contract_deviations": [],
  "migrations": [],
  "dependencies_added": [
    {
      "name": "@ai-sdk/anthropic",
      "version": "^4.0.58",
      "reason": "AI SDK provider for Claude models (PSI-098)"
    },
    {
      "name": "@ai-sdk/openai-compatible",
      "version": "^3.0.53",
      "reason": "AI SDK provider for Hermes / Nous Research OpenAI-compatible models (PSI-098)"
    }
  ]
}